{
  "requirements": {
    "rpgserver:affinity": 7
  },
  "blocks": {
    "entries": [
      "#rpgserver:wooden_racks"
    ]
  },
  
  "items": {
    "entries": [
      "minecraft:golden_hoe",
      "chipped:watering_can"
    ]
  },
  "recipes": {
    "entries": [
      "fleshz:prepared_hide"
    ]
  }
}